,DateTime,Uid,Tweet,Label (Specialist),HashTag
4245,18/8/2021 13:59,63c366ba18c7,อยากตาย,Level 1,"#ชอบผู้หญิง #มีแฟนเป็นผู้หญิงแต่โคตรมีความสุข 
#โรคซึมเศร้า"
4246,12/8/2021 13:41,63ccdeef58c1,ตอนนี้ผมทำได้แค่นอนร้องไห้และสุดท้ายแล้ววันนึงผมจะตายลงในที่สุด,Level 1,#โรคซึมเศร้า
4247,14/10/2021 05:41,652a8e2c0bde,เหมือนโดนพายุซัดกระหน่ำเข้ามาอย่างหนักฉันรับไม่ไหวฉันล้มตัวลงและภาวนาว่าพัดฉันให้หายไปจากโลกนี้ที,Level 1,#โรคซึมเศร้า
4248,2/10/2021 13:07,654633c4a41c,ถ้าหากไม่มีพรุ่งนี้เราก็ไม่เสียใจเพราะที่ผ่านมาเราทำเต็มที่แล้ว,Level 1,#โรคซึมเศร้า
4249,7/10/2021 15:32,65b251f6f1da,เป้าหมายเดียวกันคือการหายไปจากโลกนี้,Level 1,#โรคซึมเศร้า
4250,1/10/2021 15:14,65f30aa98165,เหนื่อยที่ต้องมานั่งหาเหตุผลให้ตัวเองมีชีวิตอยู่,Level 1,#ซึมเศร้าเพื่อนรัก #โรคซึมเศร้า
4251,29/9/2021 08:28,66d3a7287402,อยากหายไปไม่อยากอยู่แล้ว,Level 1,#โรคซึมเศร้า
4253,6/4/2021 15:16,6707058f3291,มีวิธีการตายที่ไม่ทรมานมั้ยคะ,Level 1,#ซึมเศร้า
4254,9/10/2021 23:37,6735c6de9968,เหนื่อยจังเลยทำไมต้องเป็นเราอีกแล้วนะทำไมเราต้องมาเจอเรื่องแย่ๆตลอดเลยนะเหนื่อยจนแทบอยากหายไปจากโลกใบนี้,Level 1,#โรคซึมเศร้า #โรคน้อยใจ
4255,25/9/2021 04:00,6759fa4627a3,ถ้าเราหายไปหละจะดีกว่าตอนนี้มั้ยนะ,Level 1,#โรคซึมเศร้า
4256,28/10/2021 19:34,6759fa4627a6,มันเกินคำว่าอยากตายไปแล้วอ่ะ,Level 1,#โรคซึมเศร้า
4257,13/10/2021 14:53,676a9a0f3cfd,ถ้ามีพรหนึ่งข้อเราจะขอให้ตัวเองหายไป,Level 1,#โรคซึมเศร้า
4258,23/9/2021 12:22,68038ad408d6,ความตายมันไม่ได้น่ากลัวเลยสักนิดการใช้ชีวิตอยู่บนโลกนี้ต่างหากที่โหดร้ายและน่ากลัวกว่าการตาย,Level 1,#อยากตาย
4259,29/9/2021 03:34,6a4d96642da9,ตอนแรกอยากหายนะแต่ตอนนี้อยากตายมากกว่า,Level 1,#โรคซึมเศร้า
4261,12/7/2021 16:37,6a7a6b052056,ชีวิตคนเราสุดท้ายก็ต้องตายงั้นถ้าฉันตายมันก็คงไม่ผิดอะไรเพราะสุดท้ายฉันก็ต้องตายอยู่ดี,Level 1,#อยากตาย #โรคซึมเศร้า #ว่างเปล่า
4262,1/10/2021 02:22,6a8c82ab5649,ทำไมตัองโชคดีทำไมต้องรอดตายอย่างฉิวเฉียดมาถึงครั้งนรกไม่ต้อนรับเราหรอ,Level 1,#โรคซึมเศร้า
4263,3/4/2021 16:14,6b0ac3db0663,มีเหตุผลที่ทำให้อยากอยู่บ้างนะแต่อยากตายมากว่าว่ะแย่นะขอโทษกับเหตุผลที่ทำให้เราอยากอยู่นะแต่อยากตาย,Level 1,#โรคซึมเศร้า
4264,24/9/2021 04:17,6b0e197c4f9e,มันรู้สึกยังไงกับการที่ยังหายใจแต่ไร้ซึ่งชีวิต,Level 1,#โรคซึมเศร้า
4265,23/9/2021 15:45,6b0e197c4f9e,จะอยู่ไปทำไมในเมือมันเจ็บปวด,Level 1,#โรคซึมเศร้า
4266,25/9/2021 13:18,6b0e197c4f9e,ยาต้านเศร้าก็กินหมอก็หาทำไมไม่หายสักทีต้องหายไปจากโลกนี้ใช่ไหมถึงจะหาความสุขเจอคนที่อยากให้อยู่ข้างๆก็ไม่มีไม่มีใครเลยจริง,Level 1,#โรคซึมเศร้า
4267,30/9/2021 12:34,6b0e197c4f9e,อยากตายมั้ยอยากตอบว่ามากแต่ใจเรามันไม่ถึงพอนี่สิ,Level 1,#โรคซึมเศร้า
4269,4/10/2021 18:22,6b0e197c4f9e,ถ้าเราตายความรู้สึกทุกอย่างมันจะหายไปมั้ย,Level 1,#โรคซึมเศร้า
4270,4/10/2021 15:51,6b0e197c4f9e,อยากตายในทุกๆวัน,Level 1,#โรคซึมเศร้า
4271,4/10/2021 14:49,6b0e197c4f9e,อยากตายเป็นคำตอบเดียวของเรา,Level 1,#ซึมเศร้า #ปรึกษาปัญหา #โรคซึมเศร้า #เหนื่อยกับชีวิต
4272,13/10/2021 15:02,6b0e197c4f9e,อยากตายอยากหนีเหนื่อยแล้ว,Level 1,#โรคซึมเศร้า
4273,12/10/2021 16:01,6b0e197c4f9e,ก็ไม่ได้บอกว่าอยากตายแค่อยากหายไปเท่านั้นเอง,Level 1,#โรคซึมเศร้า
4274,30/10/2021 06:20,6b0e197c4f9e,ไม่เคยมีสักวันเลยที่จะไม่ร้องไห้เหนื่อยจังอยากตายแล้ว,Level 1,#โรคซึมเศร้า#โรคไบโพลาร์ #โรคเครียด
4275,17/8/2021 12:45,6b29f8261f69,ถ้าไม่หายก็ตายเถอะมันทรมาน,Level 1,#ซึมเศร้า #โรคซึมเศร้า
4276,11/9/2021 05:53,6b29f8261f69,ถ้าเราตายไปก็คงดี,Level 1,#โรคซึมเศร้า
4277,4/10/2021 16:47,6bc750345ee5,การตายนี่เหมือนการฝันหรือเปล่านะ,Level 1,#โรคซึมเศร้า #ครอบครัวไม่ใช่เซฟโซน
4279,24/9/2021 04:15,6c2d2e6fa6b7,ไม่อยากเป็นคนเก่งเลยอยากเป็นคนตาย,Level 1,#โรคซึมเศร้า
4280,2/10/2021 09:07,6c7ca397c17f,มันอยู่ในจุดที่ว่าจะอยู่ก็ได้แต่จะตายก็ไม่เป็นไร,Level 1,#โรคซึมเศร้า
4281,21/10/2021 18:43,6daae7f603cf,บางคนกลัวความตายแต่เรากลับกลัวการมีชีวิตอยู่,Level 1,#โรคซึมเศร้า
4283,6/10/2021 14:45,6e7728fc8d102,ไม่ไหวแล้วตอนนี้ดิ่งมากมีคำถามมากมายเต็มไปหมดเกิดมาทำไมทำไมทำไมทำไม,Level 1,#โรคซึมเศร้า
4285,20/10/2021 21:41,6e7728fc8d105,ขอตายเลยได้ไหมไม่อยากเป็นคนเก่งแล้ว,Level 1,#โรคซึมเศร้า
4286,20/10/2021 21:34,6e7728fc8d106,ถ้าเราตายคงไม่เป็นภาระใคร,Level 1,#โรคซึมเศร้า
4287,22/10/2021 05:33,6e7728fc8d107,ขอตายเลยได้ไหมไม่อยากเป็นคนเก่งแล้ว,Level 1,#โรคซึมเศร้า
4288,1/10/2021 13:53,6e7728fc8d91,เมื่อไหร่เราจะตาย,Level 1,#เธรดซึมเศร้า #เธรดคําพูด #เธรดเศร้า#โรคซึมเศร้า
4289,1/10/2021 11:03,6e7728fc8d93,ขอโทษนะที่วันนี้เรายังหายใจอยู่เหนื่อยมากเลย,Level 1,#เธรดซึมเศร้า #เธรดคําพูด #เธรดเศร้า#โรคซึมเศร้า
4290,1/10/2021 02:50,6e7728fc8d94,อยากตายมั้ยอยากตอบว่ามากแต่ใจเรามันไม่ถึงพอนี่สิ,Level 1,#โรคซึมเศร้า
4291,10/10/2021 10:46,6e7728fc8d96,ฉันเหนื่อยนอนครั้งนี้ขอไม่ตื่นมาอีกเลยได้ไหม,Level 1,"#เธรดซึมเศร้า #เธรดคําพูด #เธรดเศร้า #เธรด #เธรดรวม #เธรดความรู้สึก #เธรดความจริง
#โรคซึมเศร้า"
4292,22/6/2021 11:36,6f8916e23f79,เหนื่อยแค่ไหนก็ไม่ตายสักทีไม่อยากกินยาไม่อยากต่อสู้กับอะไรทั้งนั้นมันหมดแรงไปตั้งหลายปีแล้ว,Level 1,#โรคซึมเศร้า
4294,18/5/2021 16:05,6f9a523d644d,เมื่อไหร่จะหลุดพ้นสักทีเหนื่อยแล้วอยากไปแล้วอะไม่อยากได้ไรแล้วอะ,Level 1,#โรคซึมเศร้า
4295,29/10/2021 09:26,6f9cabe835a6,เราไม่ควรเกิดมาไม่อยากมีตัวตนอีกต่อไปรู้สึกผิดทุกๆเรื่องรู้สึกแย่มากๆ,Level 1,#โรคซึมเศร้า
4296,26/10/2021 07:54,6O9dUk4zugVBshr,ผมเหนื่อยแล้วเหนื่อยแล้วจริงๆผมอยากหายไปจากโลกใบนี้มันแปลกมั้ยที่จะคิด,Level 1,#โรคซึมเศร้า
4297,11/10/2021 06:43,704589200ebd,อยู่ๆก็ไม่อยากทำอะไรเลยอยากจะนอนหลับไปเฉยๆแบบไม่ตื่นขึ้นมาอีก,Level 1,#โรคซึมเศร้า
4299,14/10/2021 07:28,704589200ebd,ว่าบางครั้งฉันคิดว่าอยากหลับไปไม่ตื่นไม่อยากฟื้นลืมตาขึ้นมา,Level 1,#โรคซึมเศร้า
4300,7/10/2021 17:42,71472b354bf5,เอาตรงๆบางทีแม่งก็อยากจะตายนะแบบเบื่อจะนั่งคิดแต่ว่ายังไม่ได้เจอจองกุกเลยนะยังไม่ได้ทำสิ่งที่อยากทำเลยอ่ะ,Level 1,#โรคซึมเศร้า #อยากตาย
4301,23/9/2021 01:06,71911be63858,เหนื่อยท้ออยากตายมากแต่ก็ตายไม่ได้เป็นห่วงคนข้างหลังทรมานชิบหาย,Level 1,#โรคซึมเศร้า
4302,9/10/2021 18:17,71943ff502f9,ร่างกายต้องการพักผ่อนเนาะหมายถึงพักไปเลยแบบไม่ตื่นขึ้นมาอีกแล้ว,Level 1,#โรคซึมเศร้า
4303,7/10/2021 02:15,7201a2f84258,เรารู้สึกทรมานมากทรมานจนหายใจไม่ออกจนอยากให้ใจมันขาดตายไปซักที,Level 1,#โรคซึมเศร้า
4304,22/10/2021 03:08,729186a767bc,คิดถึงความตายวันละหลายๆรอบ,Level 1,#โรคซึมเศร้า
4305,18/10/2021 18:52,73793f24f144,ไม่อยากอยู่แล้ว,Level 1,#โรคซึมเศร้า
4306,18/10/2021 18:51,73793f24f145,จีแกมันคือความผิดพลาดเข้าใจมั้ยแกมันควรตายตั้งนานแล้วแกไม่สมควรจะมีความสุขด้วยซ้ำ,Level 1,#โรคซึมเศร้า
4307,14/5/2021 13:15,739b0e964120,ถ้าตายขึ้นมาก็คงดีนะ,Level 1,#โรคซึมเศร้า
4308,30/5/2021 17:40,739b0e964120,ฉันหวังว่าจะมีใครสักคนเอาปืนมายิงหัวฉันให้ตายๆไปซะ,Level 1,#โรคซึมเศร้า
4309,3/6/2021 13:56,739b0e964120,บางทีความตายอาจจะมีความสุขกว่าตอนที่ยังอยู่,Level 1,#โรคซึมเศร้า
4310,14/5/2021 13:15,739b0e964120,ถ้าตายขึ้นมาก็คงดีนะ,Level 1,#โรคซึมเศร้า
4311,2/10/2021 08:43,73e054ef4f9c,ถ้ากูตายไปมันจะมีอะไรเปลี่ยนแปลงไหมวะ,Level 1,#โรคซึมเศร้า
4312,25/10/2021 02:04,74557a1d87c8,ถ้าผมตายนี่มันเป็นอะไรที่ดีมากเลยผมมันไร้คุณประโยชน์จริงๆผมอะไรไม่มีใครเข้าใจแต่มันทรมารเหลือเกิน,Level 1,#โรคซึมเศร้า  #อยากตาย
4313,14/10/2021 02:18,7482858b4fa3,เมื่อไหร่ร่างกายจะหยุดเคลื่อนไหวรู้ไหมใจเรามันตายไปนานแล้ว,Level 1,#โรคซึมเศร้า #โรคเครียด #สุขภาพจิต #จิตเวช
4314,17/10/2021 08:20,75646078039c,ต้องใช้เวลาเรื่องแบบนี้ต้องใช้เวลานี่มันปีแล้วนะคะต้องใช้เวลาไปอีกเท่าไหร่ตายไปง่ายกว่าไหม,Level 1,#โรคซึมเศร้า
4315,30/10/2021 16:27,758fedae7804,เราจะทนฝืนอยู่ต่อบนโลกใบนี้ได้อีกนานแค่ไหนกันนะ,Level 1,#โรคซึมเศร้า #ครอบครัวไม่ใช่เซฟโซน
4316,30/9/2021 16:36,764ee6f9f1e6,ถ้าเราตายได้โปรดอย่าร้องไห้อย่าคิดถึง,Level 1,#โรคซึมเศร้า
4317,15/10/2021 16:10,764ee6f9f1e7,ไม่อยากทำอะไรเลยไม่อยากไปทำงานไม่อยากกินข้าวไม่อยากลุกไปไหนอยากนอนหลับตาแล้วไม่ต้องตื่นมาอีกเลย,Level 1,#โรคซึมเศร้า
4318,23/10/2021 08:37,767ae9ff95fa,ให้กูตายสักทีเถอะ,Level 1,#ครอบครัวไม่ใช่เซฟโซน #อยากตาย
4319,26/10/2021 12:43,76912c18624c,อยากลบตัวตนเด็กคนนี้แล้วโอบกอดคุณแม่ก่อนจะสลายหายไป,Level 1,#โรคซึมเศร้า
4320,21/9/2021 09:10,775f39fb9d53,โคตรจะเกลียดโลกนี้เลยแม่งใจร้ายชิบหาย,Level 1,#อยากตาย
4321,21/9/2021 09:01,775f39fb9d53,ชีวิตหลังความตายอ่ะเหรอมันคงจะมีความสุขกว่านี้แหละจริงไหม,Level 1,#อยากตาย
4322,21/9/2021 08:57,775f39fb9d53,ความตายมันไม่ได้น่ากลัวเลยสักนิดการใช้ชีวิตอยู่บนโลกนี้ต่างหากที่โหดร้ายและน่ากลัวกว่าการตาย,Level 1,#อยากตาย
4323,15/5/2021 06:02,78dad0e58644,อยากตายมากหางานทำไม่ได้เลยเครียดเป็นหนี้อีกโดนโกงอีกชีวิตบัดซบ,Level 1,#โรคซึมเศร้า
4324,10/10/2021 03:48,7986dcfc5358,เหนื่อยจนอยากพอกับการมีชีวิตอยู่แล้ว,Level 1,#โรคซึมเศร้า
4325,4/10/2021 14:01,79c11b189095,ไม่ชอบตัวเองตอนนี้แค่หายใจยังเหนื่อยเลยเหมือนจะไม่ไหวแล้วไม่อยากอยู่บนโลกนี้ต่อแล้วเหนื่อย,Level 1,#โรคซึมเศร้า
4326,6/10/2021 18:41,7a71726a7910,ทำไมต้องเกิดมาด้วยอยากตายโคตรๆ,Level 1,#โรคซึมเศร้า
4327,1/10/2021 05:11,7a7ccd2d5bd6,หรือจริงๆแล้วเราควรไปได้แล้ว,Level 1,#โรคซึมเศร้า
4329,28/8/2021 14:58,7b156fc40bd0,ไม่ได้ต้องการคำขอโทษไม่อยากให้ใครรู้สึกผิดเสียใจหรือเศร้าแต่ฉันต้องการตายและหายไปจากพวกเขา,Level 1,#โรคซึมเศร้า
4330,31/5/2021 06:02,7b18f24dd04b,อยากจะหลับหลับไปแล้วไม่ต้องตื่นอยากจะหายหายไปโดยไม่มีใครตามได้อยากจะตายตายแบบไม่เหลือร่องรอย,Level 1,#โรคซึมเศร้า
4331,6/8/2021 08:33,7b18f24dd04b,ฉันไม่ต้องการวันพรุ่งนี้อีกแล้ว,Level 1,#โรคซึมเศร้า
4332,22/5/2021 20:40,7b18f24dd04b,เป็นเรามันเหนื่อยจังวะพยายามทุกอย่างก็ไม่มีอะไรดีขึ้นเลยมีแต่แย่ลงเรื่อยๆ,Level 1,#โรคซึมเศร้า
4333,26/10/2021 19:52,7b5df49fdc9c,อยู่ในจุดที่ตายก็ไม่ได้อยู่ต่อก็ไร้ประโยชน์,Level 1,#โรคซึมเศร้า
4334,31/10/2021 08:40,7bff66b5b83d,เหนื่อยกับตัวเองมากๆไม่อยากมีชีวิตอยู่เลยซักนิดเห้อทำไมยังไม่ถึงเวลาของเราซักที,Level 1,#โรคซึมเศร้า
4335,26/9/2021 15:27,7c489458830c,เบื่อแล้วชีวิตจริงอยากเป็นเจ้าหญิงบนฟ้า,Level 1,#โรคซึมเศร้า
4336,7/10/2021 15:53,7c489458830c,ไม่เคยขอพรให้ตัวเองมีชีวิตอยู่เลยสักครั้ง,Level 1,#โรคซึมเศร้า
4337,7/10/2021 15:44,7c489458830c,ทำไมถึงได้อยากตายนักชีวิตมีค่ามากพอที่จะอยู่ต่อขนาดนั้นเลยหรอ,Level 1,#โรคซึมเศร้า
4338,16/10/2021 17:41,7c489458830c,อยากหายไปนะถึงแม้จะเสียดายที่ยังใช้ชีวิตได้ไม่มากพอแต่ก็ไม่สามารถทนกับสิ่งที่ต้องเจอได้อีกแล้วทุกอย่างแย่ไปหมด,Level 1,#โรคซึมเศร้า
4339,31/10/2021 16:15,7c489458830c,บางทีก็ไม่รู้ว่าจะตื่นขึ้นทำไมทรมานเนอะ,Level 1,#โรคซึมเศร้า
4340,31/10/2021 11:46,7c489458830c,เราภาวนานะว่าสักวันเราจะไม่มีลมหายใจ,Level 1,#โรคซึมเศร้า
4341,26/10/2021 05:33,7c7faa7f3657,ไม่มีใครรู้หรอกว่าวันนึงอยากจะตายวันละร้อยอยากตายๆไปเลยเบื่อแล้วทนไม่ไหวแล้ว,Level 1,#โรคซึมเศร้า
4342,13/10/2021 01:31,7d455ba9fd45,อยากตายแต่ทำได้แค่หลับ,Level 1,#โรคซึมเศร้า
4343,7/10/2021 05:49,7dad96b27d86,เราตายได้หรือยัง,Level 1,#โรคซึมเศร้า #depresion
4344,31/10/2021 16:57,7dc5253c513c,บางทีเราตายไปก็คงดีกว่าการอยู่แบบนี้อยากตายเพราะครอบครัวมันมีอยู่จริง,Level 1,#โรคซึมเศร้า
4345,7/10/2021 14:37,7eec2ca46f42,เราไม่เคยเป็นลูกที่ดีของแม่เลยสินะเป็นลูกที่แย่มาตลอดเป็นคนที่แย่มาตลอดห่วยแตกไม่ได้รับความรักที่ดีไม่อยากจะมีชีวิตอยู่ต่อเลย,Level 1,#โรคซึมเศร้า
4346,27/6/2021 10:12,7f0410de9018,เลิกบอกให้กูอดทนสักทีเหอะกูแทบจะตายแล้วแม่งมองไม่ออกหรอกวะ,Level 1,#โรคซึมเศร้า
4347,7/10/2021 16:01,7f0e2b42b6e9,มันก็มีอีกแว้บแล้วที่อยากตาย,Level 1,#ปรึกษา #โรคซึมเศร้า #ปรึกษาปัญหาชีวิต #หมดหวัง #หาเพื่อน #จิตวิทยา
4349,13/9/2021 11:23,7f9d92d86c31,การที่คนเขาพยายามฆ่าตัวตายเขาไม่ได้เรียกร้องความสนใจนะเว้ยคือเขาแค่อยากตายไงกูแค่อยากตายไง,Level 1,#โรคซึมเศร้า
4350,4/9/2021 03:48,7fba087025bd,เมื่อไหร่จะตาย,Level 1,#อยากตาย #โรคซึมเศร้า
4351,14/9/2021 11:02,7fba087025bd,เด็กคนนึงคิดถึงเรื่องตายมากว่าการใช้ชีวิต,Level 1,#โรคซึมเศร้า #อยากตาย
4352,14/9/2021 11:02,7fba087025bd,ตายๆไปสักทีไม่อยากอยู่แล้ว,Level 1,#โรคซึมเศร้า #อยากตาย
4353,24/9/2021 03:41,803b2ca386d8,เป็นคนทำให้เราเป็นแบบนี้เองแล้วจะมาเรียกร้องอะไรจากเราอีกถ้าเราตายทุกอย่างก็จะจบใช่ไหม,Level 1,#โรคซึมเศร้า
4355,12/10/2021 09:40,84fc9fb1eb4d,เหนื่อยเบื่อเมื่อไหร่จะได้หลับไม่ต้องตื่นเมื่อไหร่เวลานั้นจะมาถึง,Level 1,#โรคซึมเศร้า
4356,25/9/2021 16:41,8527687cb5e3,อยากหายไปไม่ไหวแล้ว,Level 1,#โรคซึมเศร้า #โรคเครียด
4357,29/10/2021 10:34,86d192e603ff,ไม่รู้ว่าเกิดมาทำไมเหมือนกันว่ะอยากตายๆให้มันจบๆไปเลยอ่ะไม่อยากเรียนแล้วอยากตาย,Level 1,#โรคซึมเศร้า
4358,24/9/2021 14:10,87100af99777,หนีความเศร้าด้วยการนอนพอได้นอนแล้วก็ไม่อยากตื่น,Level 1,#โรคซึมเศร้า
4359,29/9/2021 00:35,87f09056c235,ทรมานกับการมีชีวิตอยู่,Level 1,#โรคซึมเศร้า
