,DateTime,Uid,Tweet,Label (Specialist),HashTag
1434,14/6/2021 12:31,4fc03a85d8d2,ทำไมไม่ฆ่ากูตั้งแต่กูยังอยู่ในท้องละให้กูเกิดมาทำไม,Other,#อยากตาย #โรคเครียด #โรคซึมเศร้า
1435,27/6/2021 11:31,87fbc5347b9f,อยากนอนหลับไปเลยไม่อยากรับรู้อะไรแล้ว,Level 1,#โรคซึมเศร้า
1436,1/4/2021 14:49,a3641bc15e3b,อยากตาย,Level 1,#อยากตาย
1437,2/4/2021 09:30,a3641bc15e3b,แสดงออกชัดเจนว่าไม่อยากให้เราอยู่แต่วินาทีที่เรากำลังจะไปทำไมต้องมายื้อ,Level 4,#อยากตาย
1438,1/4/2021 16:32,a3641bc15e3b,พยายามเต็มที่แล้วแต่มันหาเหตุผลในการอยู่ต่อไม่ได้จริงๆ,Level 2,#อยากตาย
1439,1/4/2021 15:37,a3641bc15e3b,เขาบอกว่าเราเป็นโรคเห็นแก่ตัวเรียกร้องเอาแต่ใจแต่พอเราจะไปจริงๆมาดึงเราไว้ทำไม,Level 4,#โรคซึมเศร้า #อยากตาย
1440,31/3/2021 13:55,a3641bc15e3b,แย่กว่าการฆ่าตัวตายคือพยายามฆ่าตัวตายแต่ไม่สำเร็จปล่อยเราไปเถอะนะ,Level 5,#อยากตาย
1441,31/3/2021 13:23,a3641bc15e3b,ก็คงต้องตายก่อนถึงจะรู้ว่าเราก็มีตัวตน,Level 2,#อยากตาย
1443,19/7/2021 23:16,9f914fa282d2,ถ้าเรากินยาทั้งหมดที่มีเราจะตายเลยไหมคะ,Level 3,#โรคซึมเศร้า
1444,10/9/2021 02:56,a3b43cf6f13d,ดาวน์ดิ่งจนอยากกรีดกรีดซ้ำๆ,Level 5,#โรคซึมเศร้า
1445,24/8/2021 17:34,e705d6b6d656,นี่มาตายด้วยกันเถอะ,Level 2,#โรคซึมเศร้า
1446,19/7/2021 11:47,9f287d01ee43,อาการข้างเคียงเยอะจังเลยนะทรมานจังทำไมไม่ตายไปเลยล่ะ,Level 1,#โรคซึมเศร้า
1447,23/7/2021 12:45,1bceab9357de,อยากกรีดแขนอีกแล้วแต่เค้าเก็บของเราไปหมดเลย,Level 5,#โรคซึมเศร้า
1449,23/7/2021 12:12,1bceab9357de,คนที่กรีดแขนไม่จำเป็นต้องอกหักโดนทิ้งหรือเรียกความสนใจมีแค่เป็นวิธีที่เราระบายความรู้สึกข้างในมาเท่านั้นเอง,Level 4,#โรคซึมเศร้า
1450,23/7/2021 04:06,1bceab9357de,ไม่มีใครอยากทำร้ายตัวเองหรือเป็นซึมเศร้าหรอกเค้าแค่รู้สึกว่าอยากให้มีคนเข้าใจคอยอยู่ข้างๆ,Level 1,#โรคซึมเศร้า
1451,23/7/2021 04:05,1bceab9357de,นอกจากการทำร้ายตัวเองทำลายข้าวของคงมีแต่น้ำตาแหละที่ยังสามารถทำได้แล้วไม่เจ็บไม่พัง,Level 4,#โรคซึมเศร้า
1452,30/6/2021 06:54,cfffe524864c,ทุกคนทำให้เราเสียใจจนเราอยากตายๆไปซะ,Level 1,#โรคซึมเศร้า
1453,18/8/2021 01:25,cfffe524864c,พรุ่งนี้ไม่อยากตื่นมาใช้ชีวิตแล้ว,Level 2,#โรคซึมเศร้า #คำคม #คมไม่คมแล้วแต่จะคิด
1454,14/5/2021 13:51,93d6c69fc99c,ยาแม่งไม่ได้ช่วยอะไรเลยกินแล้วแม่งก็เหนื่อยเพลียไม่มีแรงจากที่ซึมอยู่แล้วแม่งซึมมากกว่าเดิมอีกอยากตาย,Level 1,#โรคซึมเศร้า
1455,14/5/2021 14:11,93d6c69fc99c,ขอบคุณที่อดทนมันกำลังจะจบลงแล้ว,Level 4,#โรคซึมเศร้า
1456,24/7/2021 13:32,93d6c69fc99c,ไม่ไหวแล่วป้ะกูอยู่บนสภาพแวดล้อมนี้ไม่ได้จริงจิตใจกูแม่งถดถอยมากกูอยากตาย,Level 1,#โรคซึมเศร้า
1457,28/7/2021 12:16,93d6c69fc99c,ถามว่าแค่แมวหนีออกจากบ้านแค่นี้ก็ทำร้ายตัวเองแล้วต่อไปจะไปทำอะไรกิน,Level 5,#โรคซึมเศร้า
1458,3/9/2021 17:24,93d6c69fc99c,ขอโทษพ่อกับแม่นะแต่เค้าไม่ไหวเลย,Level 2,#โรคซึมเศร้า
1459,3/9/2021 17:21,93d6c69fc99c,อยากฉีกทึ้งตัวเองให้มันขาดเป็นชิ้นๆไปเลยแหะ,Level 1,#โรคซึมเศร้า
1460,14/5/2021 14:11,93d6c69fc99c,ขอบคุณที่อดทนมันกำลังจะจบลงแล้ว,Level 4,#โรคซึมเศร้า
1461,14/5/2021 14:48,93d6c69fc99c,ทำไมคนเราต้องมีความรู้สึกด้วยวะ,Other,#โรคซึมเศร้า
1462,5/8/2021 19:52,d7c8f10809e8,ในใจตอนนี้คือพร้อมไปแล้ว,Level 2,#โรคซึมเศร้า
1463,16/6/2021 19:32,5305b962cca4,ถ้าไม่มีฉันทุกคนคงสบายมากกว่านี้,Level 1,#โรคซึมเศร้า
1464,16/6/2021 19:16,5305b962cca4,กินยาขนาดนี้ทำไมยังไม่ตายว่ะตายยากเย็นจริง,Level 5,#โรคซึมเศร้า
1465,5/7/2021 07:22,5305b962cca4,คือเอาจริงคือไม่มีเหตุผลอะไรให้อยู่ต่อแล้วนะไม่ได้มีแพชชั่นอะไรกับการมีชีวิตแล้วอ่ะพยายามไปก็ไม่มีประโยชน์,Level 1,#โรคซึมเศร้า
1466,19/5/2021 13:10,8327e1776cf9,ชีวิตกูมันไม่มีค่าอะไรอยู่แล้ว,Other,#โรคซึมเศร้า
1467,2/6/2021 17:46,c730dcd93c62,ที่พูดว่าอยากตายไม่เคยพูดเล่นเลย,Level 2,#โรคซึมเศร้า
1468,3/4/2021 15:00,af00e7aa6d52,โรคซึมเศร้าไม่ได้เป็นอะแต่ขอตายด้วยคนได้มะมันดูน่าจะหลุดพ้นดี,Level 2,#โรคซึมเศร้า
1469,17/2/2021 14:45,a3aebc7f2c1e,อยากหายไปแบบไม่ต้องมีใครเดือดร้อน,Level 1,#อยากตาย
1470,17/2/2021 14:21,a3aebc7f2c1e,ทำไมต้องอดทนทำไมถึงงต้องใช้ชีวิตอยู่ต่อทำไมต้องทรมานขนาดนี้ในหัวมีแต่คำถาม,Level 1,#โรคซึมเศร้า
1471,2/4/2021 01:41,df94fcac5172,อายุพึ่งเป็นนางสาวเคยพยายามฆ่าตัวตายมาสองครั้งคิดจะฆ่าตัวตายนับไม่ถ้วนเห็นภาพตัวเองตอนตายนับไม่ถ้วน,Level 5,#โรคซึมเศร้า
1472,22/6/2021 09:15,d717417b0b0d,เมื่อไหร่จะถึงเวลาของเราสักที,Level 1,#โรคซึมเศร้า
1473,4/9/2021 14:38,d717417b0b0d,กูอยากตาย,Level 1,#โรคซึมเศร้า
1474,25/8/2021 16:20,4b404494fc02,อย่าเล่นกับความรู้สึกกับคนที่คิดว่าการตายคือการพักผ่อน,Level 1,"#ซึมเศร้าเพื่อนรัก #ซึมเศร้า #โรคซึมเศร้า
#แคปชั่น"
1475,18/5/2021 06:48,ff131506d102,นอนไม่หลับอีกแล้ว,Other,#Phobia #Utopia #โรคซึมเศร้า
1476,6/6/2021 00:50,db01658fcaa8,โลกนี้อยู่ยากจริงๆไม่อยากอยู่แล้วตายตอนนี้เลยได้ไหม,Level 2,#โรคซึมเศร้า
1477,23/7/2021 12:50,4735e63daaf1,เราทำมันอีกแล้ว,Level 5,#โรคซึมเศร้า #ซึมเศร้า #ชีวิต
1479,12/8/2021 19:42,c33af33ff54c,เอาจริงเราว่าเราหายแล้วนะเหลือแค่อย่างเดียวคือในหัวคิดแต่วิธีฆ่าตัวตาย,Level 3,#โรคซึมเศร้า
1480,24/8/2021 00:24,0b05052efbe7,เข้าใจแล้วทำไมถึงอยากตายกัน,Level 1,#หาเพื่อนคุย #หาเพื่อน #คุยแก้เหงา #อยากระบาย
1481,2/9/2021 17:54,0b05052efbe7,หายใจไม่ออก,Level 5,#รับจ้างคุย #เมคเฟรน #เรียลชาย
1482,31/8/2021 10:39,13b6d1d00c1b,เมื่อไหร่น่าจะมารับจะวิ่งไปกลางถนนจริงๆแล้วนะ,Level 4,#บีบมือ​ #โรคซึมเศร้า
1483,22/6/2021 15:02,1b4a30af1b47,หรือจริงๆแล้วกูไม่ควรเกิดมาตั้งแต่แรกวะ,Other,#โรคซึมเศร้า
1484,23/6/2021 17:56,076a5375686a,หรือจริงๆแล้วเราไม่ควรที่จะอยู่ต่อไป,Level 1,#โรคซึมเศร้า
1485,29/6/2021 16:27,afa64d06ce80,ไม่อยากทำอะไรไม่มีอะไรที่อยากได้เบื่อและเฉยชาตายสักทีเถอะตัวฉัน,Level 1,#ซึมเศร้า #โรคซึมเศร้า
1486,31/5/2021 15:12,ff57244f44e0,มีใครเห็นกูไหมไอ้เหี้ยอยากตายว่ะหายใจไม่ค่อยออกเลย,Level 5,#โรคซึมเศร้า
1487,22/6/2021 22:57,ff57244f44e0,อยากทิ้งตัวลงนอนตลอดไปแบบไม่ต้องตื่นแล้ว,Level 1,#โรคซึมเศร้า
1489,30/5/2021 23:59,ff57244f44e0,เตรียมจะพักอย่างเต็มที่แล้วนะบาย,Level 4,#โรคซึมเศร้า
1490,31/5/2021 15:12,ff57244f44e0,ถ้าไม่ไหวแล้วการหายไปก็คงจะดี,Level 1,#โรคซึมเศร้า
1491,1/6/2021 05:27,8f8fd091b201,คนที่ฆ่าตัวตายไม่ใช่คนเห็นแก่ตัว,Other,#โรคซึมเศร้า
1492,25/8/2021 13:55,8f8fd091b201,เคยเกลียดคนๆนึงมากจนอยากให้เขาไม่มีตัวตนบนโลกใบนี้มั้ยแต่สุดท้ายก็ได้แต่คิดว่าถ้าเราหายไปเองมันน่าจะดีกว่า,Level 1,#โรคซึมเศร้า
1493,28/5/2021 01:44,27fad45a5f7c,ตายยังไงไม่ให้ถูกตราหน้าว่าเป็นคนโง่คนเห็นแก่ตัวคนอกตัญญู,Level 1,"#ภาวะความเครียด 
#โรคซึมเศร้า"
1494,28/5/2021 01:44,27fad45a5f7c,เราต้องหายไปใช่ไหม,Level 1,#ภาวะความเครียด #โรคซึมเศร้า
1495,30/6/2021 10:04,1f12408becc7,แค่ตายปัญหาทุกอย่างก็จะจบใช่มั้ย,Level 1,"#โรคซึมเศร้า #โรคเครียด #ซึมเศร้า 
#อยากตาย​ #แผนกจิตเวช"
1496,30/6/2021 10:04,1f12408becc7,ก็พยายมามากแล้วเหมือนกันนะ,Other,#โรคซึมเศร้า #โรคเครียด #ซึมเศร้า #อยากตาย​ #แผนกจิตเวช
1497,7/4/2021 17:55,ff04b77db8ab,สักทีได้มั้ยไม่อยากอยู่จริงๆเลย,Level 2,#โรคซึมเศร้า
1498,27/6/2021 11:43,0711e9bb4771,ถ้าสัตว์เลี้ยงที่รักที่สุดตายเราก็ไม่ต้องรับผิดชอบชีวิตใครอีกแล้วถึงตอนนั้นเราจะตายไปกับมัน,Level 1,#โรคซึมเศร้า
1499,26/6/2021 14:41,0711e9bb4771,ถ้าวันหนึ่งเราไม่อยู่แล้วไม่ต้องร้องไห้ไม่ต้องเสียใจกับการที่เราตัดสินใจแบบนี้มันอาจจะเป็นทางออกเดียวที่ดีที่สุดสำหรับเรา,Level 1,#โรคซึมเศร้า
1500,14/9/2021 13:43,336f0873c071,อยากจะฆ่าตัวตายโดยการเดินลงไปในทะเลเรื่อยๆจนจมน้ำไปเองอยากอยู่กับทะเลไปตลอด,Level 3,#โรคซึมเศร้า
1501,15/5/2021 07:46,bbb685369f76,เราก็ไม่ได้อยากมีชีวิตอยู่ต่อหรอกแต่เราก็ไม่รู้ว่าทำไมตอนนี้เราต้องหายใจอยู่ด้วยทำไมไม่หยุดหายใจสักที,Level 1,#โรคซึมเศร้า
1502,8/6/2021 15:31,d35bbbd881d7,เหนื่อยอยากตาย,Level 1,#อยากตาย
1503,18/7/2021 18:12,d35bbbd881d7,จริงอย่างที่เขาพูดกันแค่ไม่มีกูทุกคนจะไม่เจอเรื่องแย่ๆเหี้ยๆแบบนี้เลย,Other,#โรคซึมเศร้า #อยากตาย
1504,23/7/2021 04:09,Hoon96J,รอยแผลมันไม่ได้สวยหรอกนะแต่มันบ่งบอกได้ว่ารอยนั้นมาจากปัญหาเรื่องอะไรต่างหาก,Level 5,#โรคซึมเศร้า
1506,22/8/2021 13:59,4b1cedd8c4fb,เมื่อไหร่จะตายทำไมให้คนที่อยากตายตายสมใจอยากแบบเราซักที,Level 2,#โรคซึมเศร้า  #โรคเครียด
1507,20/5/2021 13:00,4b1cedd8c4fb,บางทีที่ทุกคนเครียดทุกคนก็อาจจะบอกว่าเวลาที่หลับคือเวลาที่ได้พักทุกอย่างแต่ของหนูไม่ว่าจะตื่นหรือจะหลับมันก็ทรมานทุกเวลาเลย,Other,#โรคเครียด  #โรคซึมเศร้า
1508,28/6/2021 18:14,1f0303907c0d,มีวิธีตายแบบไม่ทรมานป่ะใช้ชีวิตไม่ไหวแล้วอ่ะ,Level 3,#โรคซึมเศร้า
1509,28/6/2021 18:12,1f0303907c0d,อยากตายแล้วจะมารักษาทำไมจริงเนอะหมอ,Level 5,#โรคซึมเศร้า
1510,20/7/2021 10:23,2b485040f363,ถ้าเลือกได้เราไม่อยากมีชีวิตอยู่ต่อเลยแม้จะวินาทีเดียว,Level 1,#โรคซึมเศร้า
1511,17/6/2021 02:16,57f8d06d653d,อายุแค่นี้โตพอจะตายได้รึยัง,Level 1,#โรคซึมเศร้า
1512,17/6/2021 02:13,57f8d06d653d,อยู่ๆก็ร้องไห้รู้สึกเหมือนไม่มีใครไม่เหลืออะไรไม่มีเป้าหมายในชีวิตและไม่เสียใจถ้าตัวเองตายไป,Level 1,#โรคซึมเศร้า
1515,5/6/2021 10:16,c307e57eea7a,อยากนอนแล้วไม่ตื่น,Level 1,"#คนอื่นที่ไม่ใช่ครอบครัว
#โรคซึมเศร้า"
1516,5/6/2021 10:14,c307e57eea7a,ยาและรอยแผลที่เพิ่มมาปีกว่าแล้วนะเมื่อไหร่จะหาย,Level 5,#โรคซึมเศร้า
1517,4/4/2021 15:22,5b31b849088c,อยากหลับแล้วไม่อยากตื่นขึ้นมาเจออะไรแบบนี้เลยอยากจะหลับไปยาวๆ,Level 1,#โรคซึมเศร้า
1518,4/4/2021 15:22,5b31b849088c,อยากหายไปจากทุกคนที่รู้จักมันคงไม่เป็นไรหรอกมั้ง,Level 1,#โรคซึมเศร้า
1519,6/4/2021 17:57,dbabc775311e,โมโหโมโหมากพอนึกถึงแล้วโมโหสุดๆต้องเป็นโรคซึมเศร้าเพราะคนอื่นอยากจะตายประชดแม่ง,Level 1,#โรคซึมเศร้า
1520,30/7/2021 16:55,73e7a3eb27d3,ขอให้พนไม่ต้องตื่นมา,Level 1,#อยากตาย#ซึมเศร้า #อยากตาย #ลงทะเบียนฉีดวัคซีน
1521,25/8/2021 15:39,83ad6f784262,อยากโดดตึกฆ่าตัวตาย,Level 4,#โรคซึมเศร้า
1522,19/7/2021 18:05,ab2b6c93b41c,กลับมาแล้วกลับมาทำร้ายตัวเองอีกแล้ว,Level 5,#โรคซึมเศร้า
1524,19/7/2021 17:59,ab2b6c93b41c,ถ้าผมตายจริงๆทุกอย่างในตัวผมทั้งความคิดความรู้สึกทุกอย่างๆภาระชีวิตคงจะจบตามไปด้วยมันดีจริงๆใช่มั๊ย,Level 2,#โรคซึมเศร้า
1525,4/4/2021 11:43,ef41174c670b,ตอนนี้เราสับสนมากๆว่าอยากหายจากโรคซึมเศร้าหรืออยากพอกับการใช้ชีวิตแค่นี้แต่คือเราไม่รู้จะไปยังไงทางไหนก็เหมือนจะทำให้คนอื่นลำบากหมด,Level 1,#โรคซึมเศร้า
1526,25/8/2021 12:19,2f9f5d5681b9,เกลียดการกินยากลัวความสูงอยากกระโดดตึกไม่ชอบน้ำลึกอยากจมน้ำตาย,Level 3,#โรคซึมเศร้า
1527,16/9/2021 18:14,2f9f5d5681b9,โดดลงไปทุกอย่างจะจบไหม,Level 4,#โรคซึมเศร้า
1528,3/6/2021 18:06,8bca13c80bce,ซ่อนแผลจนเลือดเลอะนาฬิกาเลย,Level 5,#โรคซึมเศร้า
1529,5/8/2021 04:16,ff2d66ab16c2,ขอร้องเอาชีวิตฉันไปได้แล้ว,Level 1,#โรคซึมเศร้า #อยากตาย
1530,5/8/2021 03:59,ff2d66ab16c2,กูจะอยู่ทำไมอยู่ให้คนในครอบครัวด่างี้เหรอกูขอตายดีกว่า,Level 1,#โรคซึมเศร้า
1531,5/8/2021 05:30,ff2d66ab16c2,ตั้งแต่เมื่อไหร่กันนะที่อยากตายมากกว่าหิวข้าว,Level 1,#อยากตาย
1532,5/8/2021 05:11,ff2d66ab16c2,อยากรู้จังตายไปจะมีอะอยู่กันนะ,Level 1,#อยากตาย
1533,4/8/2021 12:46,ff2d66ab16c2,ความฝันเดียวของฉันคือการตาย,Level 1,#อยากตาย
1534,4/8/2021 12:43,ff2d66ab16c2,คนที่คิดฆ่าตัวตายไม่ใช่คนที่คิดสั้นเขาคิดมาเป็นพันๆครั้งแล้ว,Level 2,#อยากตาย
1535,4/8/2021 12:42,ff2d66ab16c2,อยากตายแต่ไม่กล้าพอ,Level 1,#อยากตาย
1536,4/8/2021 12:41,ff2d66ab16c2,ตายไปไม่ดีกว่าหรอ,Level 1,#อยากตาย
1537,4/8/2021 12:38,ff2d66ab16c2,อยู่ต่อไปทำไม,Other,#อยากตาย
1538,4/8/2021 12:38,ff2d66ab16c2,อยากตายว่ะเบื่อโรคนี้มากเมื่อไรมันจะหายๆซักทีว่ะเฮงซวย,Level 1,#อยากตาย
1539,4/8/2021 12:37,ff2d66ab16c2,ถ้าเราตายจะมีคนมาสนใจบ้างมั้ยนะ,Level 1,#อยากตาย
1540,4/8/2021 12:35,ff2d66ab16c2,อยากลองตายดูนะแต่ก็คิดว่าถ้าตายตอนนี้มันยังดูไม่เท่เอาเสียเลย,Other,#อยากตาย
1541,4/8/2021 12:33,ff2d66ab16c2,ถึงในโลกแห่งความฝันจะฝันร้ายก็เถอะแต่ก็ยังดีกว่าอยู่บนโลกแห่งความจริง,Other,#อยากตาย
1544,10/8/2021 11:32,ff2d66ab16c2,ไม่ปล่อยให้ตายแล้วจะได้หลุดพ้นจากความทรมาณแต่ปล่อยให้มีชีวิตอยู่ให้พวกคุณทำร้ายเราอีกน่ะหรอ,Level 1,#โรคซึมเศร้า
1545,10/8/2021 11:17,ff2d66ab16c2,เคยทำร้ายตัวเองมาแล้วครั้งมันก็คงจะมีครั้งต่อไปอีกแน่เลย,Level 5,#อยากตาย #โรคซึมเศร้า
1546,10/8/2021 11:44,ff2d66ab16c2,เมื่อก่อนก็เคยกลัวเลือดนะแต่ตอนนี้ชินแล้ว,Level 5,#อยากตาย #คนโง่
1547,10/8/2021 11:13,ff2d66ab16c2,เหนื่อยที่จะอยู่ต่อ,Other,#อยากตาย #โรคซึมเศร้า
1548,10/8/2021 10:59,ff2d66ab16c2,คิดกี่ทีก็อยากตายวะ,Level 2,#อยากตาย
1549,10/8/2021 10:54,ff2d66ab16c2,เรามาฆ่าตัวตายด้วยกันไหมมานะ,Level 2,#อยากตาย
1550,10/8/2021 10:53,ff2d66ab16c2,อยากตาย,Level 1,#อยากตาย  #เสียงกระซิบจากความมืด
1551,10/8/2021 07:09,ff2d66ab16c2,อยากตายอยากตายอยากตายอยากตายอยากตายอยากตายอยากตายอยากตายอยากตายอยากตาย,Level 1,#อยากตาย
1553,5/8/2021 04:16,ff2d66ab16c2,ความฝันเดียวของฉันคือการตาย,Level 1,#โรคซึมเศร้า #อยากตาย
1554,5/8/2021 03:51,ff2d66ab16c2,คนที่คิดฆ่าตัวตายไม่ใช่คนที่คิดสั้นเขาคิดมาเป็นพันๆครั้งแล้ว,Level 2,#อยากตาย
1555,4/8/2021 12:46,ff2d66ab16c2,อยู่ต่อไปทำไม,Other,#อยากตาย
1558,5/9/2021 13:25,ff2d66ab16c2,ไม่ต้องรู้สึกผิดหรอกเรามันอ่อนแอจากความคิดแย่ๆของแกเท่านั้นเอง,Other,#อยากตาย
