,DateTime,Uid,Tweet,Label (Specialist),HashTag
0,18/5/2021 07:24,a38755f80aee,ถ้าฉันตายไปจริงๆก็คงดีสินะ,Level 2,#โรคซึมเศร้า
1,20/5/2021 16:06,a38755f80aee,เหนื่อยเหนื่อยจนจะตายอยู่แล้วมันไมกันนะนั่งเล่นเฉยๆหัวเราะอยู่ดีๆมันก็ดิ่งขึ้นมา,Level 1,#โรคซึมเศร้า
2,16/6/2021 07:00,9b7d113b270a,พยายามที่จะมีชีวิตอยู่แต่ก็เหนื่อยกับโลกนี้เหลือเกินเหนื่อกับการใช้ชีวิตตอนนี้ฉันเหนื่อยเหนื่อยมากจริงๆ,Level 1,#โรคซึมเศร้า
3,28/5/2021 18:43,0b981040c16d,ชีวิตก็มีอยู่แค่นี้อยากหายไปแล้วนะ,Level 1,#โรคซึมเศร้า
4,13/7/2021 18:06,937c5794646d,วันวุ่นๆของวัยรุ่นกินยาเกินขนาดกรีดแขนพร้อม,Level 5,#โรคซึมเศร้า
5,1/6/2021 05:47,57f512e6bc53,เมื่อไหร่นะที่หายไปจากโลกนี้ชีวิตแม่งไร้ค่า,Level 1,#โรคซึมเศร้า
6,20/5/2021 15:51,63f76b567278,อยากตาย,Level 1,#โรคซึมเศร้า
7,19/7/2021 16:27,c37c041e1dd4,อยากตายๆไปซะครอบครัวจะได้รักกูซักที,Level 1,#โรคซึมเศร้า
8,30/5/2021 20:12,cba844c4b3ec,เวลาทนความเจ็บปวดไม่ไหวแล้วชอบทำร้ายตัวเองแก้ยังไงดีคะ,Level 5,#โรคซึมเศร้า
9,1/6/2021 19:39,cba844c4b3ec,หาซื้อไซยาไนด์ครับไม่ก็ปืนถูกๆก็ได้ใครมีร้านที่พอจะรู้ช่วยมาหน่อยครับ,Level 4,#โรคซึมเศร้า
10,31/5/2021 07:34,cba844c4b3ec,เหนื่อยแล้วตายยังไงเจ็บน้อยสุดอะ,Level 3,#โรคซึมเศร้า
11,2/9/2021 09:45,e7b97df2790a,เราเหนื่อยเมื่อไหร่จะหลุดพ้นอะไรแบบนี้สักที,Level 1,#ความสุขที่หายไป #ซึมเศร้า #ซึมเศร้าเพื่อนรัก
12,21/5/2021 01:50,873e1b3ad2b3,ไม่มีใครอยากตายหรอกเขาแค่กลัวการมีชีวิตเท่านั้นเอง,Level 1,#โรคซึมเศร้า #ไบโพลาร์
13,4/9/2021 08:20,13e1d3929b31,มีอะไรที่ทำให้หายไปโดยที่ไม่ต้องฆ่าตัวตายมั้ยอยากจบชีวิตเอาไว้ตรงนี้เหนื่อย,Level 1,#โรคซึมเศร้า
14,4/9/2021 08:16,13e1d3929b31,ไม่น่าเกิดมาเลยเบื่อเกลียดตัวเองชิบหาย,Level 1,#โรคซึมเศร้า
15,11/9/2021 06:14,13e1d3929b31,ใกล้ถึงวันเกิดตัวเองแล้วสินะฆ่าตัวตายในวันเกิดดีมั้ยนะ,Level 3,#โรคซึมเศร้า
16,13/9/2021 09:35,13e1d3929b31,ขอโทษนะที่เกิดมาไร้ค่าขนาดนี้,Level 1,#โรคซึมเศร้า
17,16/9/2021 02:57,13e1d3929b31,ถ้าเรียนต่อจะตายไวขึ้นรึป่าว,Level 1,#โรคซึมเศร้า
18,19/9/2021 10:45,13e1d3929b31,วันนี้ไม่อยากกินยาแล้วอยากจะจากโลกนี้ไปเป็นเพียงความทรงจำก็พอเจ็บปวด,Level 1,#โรคซึมเศร้า
19,17/6/2021 03:46,976063cef5b3,ต้องกินยากี่เม็ดถึงจะเกือบตายคะหรือต้องกินกับแอลกอฮอล์,Level 4,#โรคซึมเศร้า
21,4/9/2021 14:44,976063cef5b3,ถ้าวันนึงฉันทนไม่ไหวแล้วมันกลายเป็นว่าไม่ฉันรักตัวเองเลยเหรอ,Level 1,#โรคซึมเศร้า
22,14/9/2021 13:05,976063cef5b3,ถ้าตอนนี้มีใครมาฆ่ากูให้ตายก็คงดี,Level 1,#โรคซึมเศร้า
23,5/8/2021 23:05,9b775d4e2ab7,ทำไมไม่เป็นเราที่ตายคนอยากตายอยู่ตรงนี้ให้คนที่เขาอยากมีชีวิตได้มีชีวิตอยู่ต่อไปเถอะ,Level 1,#โรคซึมเศร้า
24,18/5/2021 05:46,5758f9083a5e,ไหนอะเหตุผลที่ทำให้อยากอยู่ต่อ,Level 1,#โรคซึมเศร้า
25,2/8/2021 17:25,5758f9083a5e,ทำไมการมีชีวิตอยู่ถึงทรมานแบบนี้นะ,Level 1,#โรคซึมเศร้า
26,18/5/2021 05:45,5758f9083a5e,กินยาแล้วแต่ไม่ง่วงเลยแต่ก็ทำงานไม่ได้เช่นกันไร้ประโยชน์สิ้นดี,Other,#โรคซึมเศร้า
27,23/6/2021 16:06,1bff02682eec,มีใครวางแผนว่าจะจากไปภายในสิ้นปีนี้บ้าง,Level 2,#โรคซึมเศร้า
28,14/5/2021 14:27,4ff4aa83a4df,ถ้าหายไปคงดีสินะ,Level 1,#โรคซึมเศร้า
30,14/5/2021 14:18,4ff4aa83a4df,ต้องอยู่กับมันอีกนานเท่าไร,Level 1,#โรคซึมเศร้า
31,29/6/2021 05:36,e751bdbfbcc4,เหนื่อยที่จะตามงานแล้วเหนื่อยที่จะใช้ชีวิตแล้วเหนื่อยที่จะอยู่ต่อไปแล้วขอหลับไปตลอดกาลเถอะนะ,Level 1,#ซึมเศร้า #ปัญหาครอบครัว #อยากตาย
32,26/8/2021 19:19,f36be2d4eeff,แค่เรื่องบางเรื่องยังตัดสินใจเองไม่ได้เลือกเองไม่ได้ทุกอย่างมันต้องขึ้นอยู่กับคนรอบข้างงั้นหรือ,Other,#อยากตาย
33,12/7/2021 14:22,4ba1846fe0c6,ทำไมเราถึงไม่ตายไปให้มันจบอะ,Level 1,#โรคซึมเศร้า
34,18/5/2021 20:19,8300ba0eba8a,หรือทางเดียวที่จะหลุดพ้นได้คือความตาย,Level 1,#โรคซึมเศร้า
35,17/5/2021 17:34,8300ba0eba8a,เหนื่อยและท้อหาความสุขให้ตัวเองไม่ได้จนบางครั้งก็รู้สึกว่าไม่ไหวอยากตายไปจากโลกนี้,Level 1,#โรคซึมเศร้า
36,30/5/2021 05:55,ff07cb317b2f,หมอถามว่ามีความคิดอยากฆ่าตัวตายมั๊ยเราไม่ได้อยากฆ่าตัวตายนะเราแค่อยากหายไปเฉยๆ,Level 1,#โรคซึมเศร้า
38,17/8/2021 16:48,93d0a596cf97,เจ็บปวดเศร้าสับสนทรมานมากเหลือเกินฉันอยากตายอยากตายมากๆจะคลั่งอยู่แล้วจะประสาทกลับแล้ว,Level 3,#โรคซึมเศร้า #โรคแพนิค #depression #depressed
39,26/6/2021 15:33,6f333e4f0b58,เราตายในความคิดตัวเองเป็นร้อยๆรอบแล้วเมื่อไหร่จะตายจริงนะ,Level 3,#โรคซึมเศร้า
41,9/6/2021 10:35,b7776cf501a9,เก่งเหมือนกันนะที่พยายามอยู่ทั้งๆที่ไม่อยากอยู่,Level 1,#โรคซึมเศร้า #อยากตายตั้งแต่อายุ16 #ซึมเศร้า #อยากตาย
42,10/6/2021 21:36,b7776cf501a9,ก็จริงที่ชีวิตมันมีครั้งเดียวแต่ทำไมมันถึงไม่น่าอยู่,Level 1,#ซึมเศร้า  #โรคซึมเศร้า #อยากตาย#อยากตายตั้งแต่อายุ16 #เสียงกระซิบจากความมืด
43,10/6/2021 21:00,b7776cf501a9,เหนื่อยเหนื่อยเหนื่อยไม่ไหวแล้ว,Level 1,#ซึมเศร้า #อยากตาย
44,10/6/2021 20:55,b7776cf501a9,ถ้าการที่เราร้องไห้แล้วมันดีขึ้นมันก็ดีแต่เราร้องไห้บ่อยเกินไปจนเราไม่อยากร้องไห้มันอีกแล้ว,Level 1,#ซึมเศร้า #อยากตาย #โรคซึมเศร้า
45,9/6/2021 10:37,b7776cf501a9,ตายไปตั้งแต่แรกก็ดี,Level 1,#โรคซึมเศร้า #ซึมเศร้า
46,9/6/2021 10:35,b7776cf501a9,กุอิจฉาคนที่ตายไปแล้วว่ะ,Level 1,#โรคซึมเศร้า #อยากตายตั้งแต่อายุ16 #ซึมเศร้า #อยากตาย
47,10/6/2021 21:00,b7776cf501a9,ใครสนใจละถ้ากูตายไปแล้วมึงจะมาเสียใจให้กูทำไมทั้งๆที่มึงไม่ได้ทำดีกับกูทั้งแต่แรกแล้ว,Level 1,#ซึมเศร้า #อยากตาย
48,10/6/2021 20:55,b7776cf501a9,ฉันทำทุกอย่างไปเพื่ออะไร,Other,#ซึมเศร้า #อยากตาย #โรคซึมเศร้า
49,17/6/2021 04:07,b7776cf501a9,อยากตายทุกวันเลยอีเหี้ย,Level 1,#โรคซึมเศร้า #ซึมเศร้า
50,7/7/2021 07:15,b7776cf501a9,เพื่อจะมีชีวิตอยู่ต้องปรับตัวเพื่อที่จะรักใครสักคนต้องปรับใจแต่ถึงอยู่ไปก็ไม่มีใครรักหรอก,Level 1,#โรคซึมเศร้า
51,12/7/2021 12:17,b7776cf501a9,เหนื่อยเหนื่อยจริงๆเหนื่อยจนอยากหายไปจากที่นี้,Level 1,#เรียนออนไลน์เราจะตายกันหมด
52,12/7/2021 12:02,b7776cf501a9,ถ้าตายตอนนี้คงไม่รู้สึกอะไรแล้วแหละหลับสบายคงดี,Level 3,#อยากตาย #โรคซึมเศร้า #ซึมเศร้า#กรีดแขน #อยากตาย
53,19/7/2021 03:50,b7776cf501a9,โลกนี้โหดร้ายกับฉันจัง,Level 1,#โรคซึมเศร้า #อยากตาย
55,23/7/2021 18:31,b7776cf501a9,ก็แหงแหละไม่มีใครเข้าใจผมหรอกว่าต้องทุกข์ทรมานแค่ไหน,Level 1,#โรคซึมเศร้า #ซึมเศร้า #อยากตาย
56,23/7/2021 18:29,b7776cf501a9,หมดหนทางการใช้ชีวิตแล้ว,Level 1,#โรคซึมเศร้า #ซึมเศร้า #อยากตาย
57,22/7/2021 21:31,b7776cf501a9,เหนื่อยมากเลยโว้ยจะทนไม่ไหวแล้ว,Level 1,#โรคซึมเศร้า #อยากตาย
58,22/7/2021 13:17,b7776cf501a9,เมื่อไหร่กูจะตายวะอีเหี้ยเบื่อฉิบหายเวลากรรมของกูทำไมยาวนานจังอีสัสรีบๆตายเหอะกูเนี่ยเหนื่อยแล้วไอเวร,Level 1,#โรคซึมเศร้า #อยากตาย
59,24/7/2021 02:18,b7776cf501a9,เมื่อไหร่กูจะตายวะอีเหี้ยเบื่อฉิบหายเวลากรรมของกูทำไมยาวนานจังอีสัสรีบๆตายเหอะกูเนี่ยเหนื่อยแล้วไอเวร,Level 1,#อยากตาย #โรคซึมเศร้า
60,23/7/2021 18:31,b7776cf501a9,ถ้ามีหนูเป็นลูกมันแย่มากหนูตายให้ก็ได้นะหนูไม่ได้เสียดายชีวิตเท่าไหร่หรอก,Level 2,#โรคซึมเศร้า #ซึมเศร้า #อยากตาย
61,23/7/2021 18:29,b7776cf501a9,แนะนำวิธีทำร้ายตัวเองแบบไม่เจ็บให้หน่อยค่ะ,Level 3,#โรคซึมเศร้า #ซึมเศร้า #อยากตาย
62,30/7/2021 19:23,b7776cf501a9,ในความคิดฉันตายเป็นพันครั้งต่อนาที,Level 1,#โรคซึมเศร้า #ซึมเศร้า #อยากตาย
63,29/7/2021 22:34,b7776cf501a9,ไม่อยากอยู่แล้ว,Level 1,#โรคซึมเศร้า #ซึมเศร้า #อยากตาย
64,10/8/2021 12:31,b7776cf501a9,ชีวิตนี้ไม่หวังอะไรอีกแล้วอยู่ไปก็ไม่มีความหมายอะไรอีกแล้วโลกนี้มันช่างโหดร้ายเกินที่คนอย่างเราจะทนไหว,Level 3,#โรคซึมเศร้า #ซึมเศร้า
65,11/8/2021 19:47,b7776cf501a9,พูดได้เต็มปากเลยถ้าเราฆ่าตัวตายต้นเหตุมาจากพ่อแม่ทั้งหมด,Level 2,#โรคซึมเศร้า #ซึมเศร้า
66,18/8/2021 19:16,b7776cf501a9,แรงในบัลดาลใจสุดท้ายในการมีชีวิตอยู่เริ่มถูกทำลายไปช้าๆโดยที่เราทำอะไรไม่ได้เลยได้แต่เฝ้าดูแล้วทรมานกับสิ่งที่เป็น,Level 1,#โรคซึมเศร้า #ซึมเศร้า
68,18/8/2021 19:00,b7776cf501a9,อยากตายขอวิธีตายแบบง่ายๆหน่อยสิ,Level 3,#โรคซึมเศร้า #ซึมเศร้า
69,17/8/2021 18:25,b7776cf501a9,ถ้าติดโควิดจริงก็ขอให้ตายเลยนะ,Level 1,#โรคซึมเศร้า
70,17/8/2021 18:08,b7776cf501a9,เราเหนื่อยที่แปลว่าเราเหนื่อยกับการมีชีวิตบนโลกใบนี้ไม่ได้เหนื่อยเพราะทำงานหรือเพราะอะไร,Level 1,#โรคซึมเศร้า #ซึมเศร้า
71,18/8/2021 19:21,b7776cf501a9,เกลียดตัวเองชอบหายมีแต่ทำให้อะไรๆแย่ลงเราควรอยู่คนเดียวไม่ก็หายไปซะ,Level 1,#โรคซึมเศร้า #ซึมเศร้า
72,17/8/2021 18:25,b7776cf501a9,ถ้าวันหนึ่งผมตายไปใครละที่จะเสียใจ,Other,#ซึมเศร้า #โรคซึมเศร้า
73,17/8/2021 18:04,b7776cf501a9,กูยังทรมานไม่พออีกหรอวะต้องตายก่อนหรือไงกัน,Level 1,#มออุบล #ซึมเศร้า
74,17/8/2021 17:54,b7776cf501a9,ทำไมต้องเกิดมาอ้วนถามตัวเองซ้ำๆทุกวันเคยตั้งใจออกกำลังกายคุมอาหารแต่น้ำหนักก็ไม่ลดเลยท้อเครียดเหนื่อยอยากตาย,Level 1,#โรคซึมเศร้า #ซึมเศร้า
75,17/8/2021 09:02,b7776cf501a9,จะตายไหมคะ,Other,#โรคซึมเศร้า #ซึมเศร้า
76,25/8/2021 02:07,b7776cf501a9,รู้อยู่แก่ใจแหละว่าอยากตายแต่เสียดายที่เป็นปืนปลอม,Level 5,#โรคซึมเศร้า #ซึมเศร้า #โรคเครียด #อยากตาย
77,18/8/2021 19:21,b7776cf501a9,เกลียดตัวเองชอบหายมีแต่ทำให้อะไรๆแย่ลงเราควรอยู่คนเดียวไม่ก็หายไปซะ,Level 1,#โรคซึมเศร้า #ซึมเศร้า
78,18/8/2021 19:11,b7776cf501a9,อยากจะบอกทุกคนให้รับรู้นะคนที่เป็นซึมเศร้าอะเขาไม่คิดจะทำร้ายคนอื่นเขาคิดทำร้ายตัวเอง,Other,#โรคซึมเศร้า #ซึมเศร้า
79,17/8/2021 18:25,b7776cf501a9,ถ้าวันหนึ่งผมตายไปใครละที่จะเสียใจ,Other,#ซึมเศร้า #โรคซึมเศร้า
80,17/8/2021 18:04,b7776cf501a9,กูยังทรมานไม่พออีกหรอวะต้องตายก่อนหรือไงกัน,Level 1,#มออุบล #ซึมเศร้า
81,17/8/2021 17:54,b7776cf501a9,ทำไมต้องเกิดมาอ้วนถามตัวเองซ้ำๆทุกวันเคยตั้งใจออกกำลังกายคุมอาหารแต่น้ำหนักก็ไม่ลดเลยท้อเครียดเหนื่อยอยากตาย,Level 1,#โรคซึมเศร้า #ซึมเศร้า
83,23/8/2021 15:27,b7776cf501a9,ใครมีวิธีหยุดความคิดอยากทำร้ายตัวเองบ้างง่า,Level 5,#โรคซึมเศร้า
84,26/8/2021 03:48,b7776cf501a9,ขอวิธีฆ่าตัวตายค่ะจริงจังค่ะ,Level 3,#โรคซึมเศร้า #ซึมเศร้า
85,26/8/2021 03:47,b7776cf501a9,กูขอวิธีฆ่าตัวตายขอร้องจริงจังทนไม่ไหวกับชีวิตนี้แล้ว,Level 3,#โรคซึมเศร้า #ซึมเศร้า
86,26/8/2021 01:39,b7776cf501a9,อยากตายโดยไม่ต้องทำร้ายตัวเอง,Level 1,#โรคซึมเศร้า #ซึมเศร้า
87,25/8/2021 02:50,b7776cf501a9,เราฆ่าตัวตายดีมั้ยเราเหนื่อยๆมากเราเกลียดครอบครัวตัวเอง,Level 2,#โรคซึมเศร้า
88,25/8/2021 01:49,b7776cf501a9,อยากหายไปโดยที่คนรอบข้างไม่รับรู้,Level 1,#โรคซึมเศร้า #โรคเครียด #ซึมเศร้า #เครียด
89,25/8/2021 02:07,b7776cf501a9,ซักวันเราจะจากไปอย่างเงียบๆโดยที่พวกคุณไม่ต้องลำบาก,Level 1,"#โรคซึมเศร้า #ซึมเศร้า #โรคเครียด 
#อยากตาย"
90,4/9/2021 07:32,b7776cf501a9,โลกหลังความตายจะสบายกว่าโลกนี้รึป่าว,Other,#โรคซึมเศร้า #ซึมเศร้า
91,14/5/2021 15:22,13c080babc96,อยากนอนหลับไปแล้วไม่ต้องตื่นเลยไม่ต้องมารับรู้อะไรเกี่ยวกับโลกนี้แล้ว,Level 1,#โรคซึมเศร้า
92,14/5/2021 15:22,13c080babc96,อยากนอนหลับไปแล้วไม่ต้องตื่นเลยไม่ต้องมารับรู้อะไรเกี่ยวกับโลกนี้แล้ว,Level 1,#โรคซึมเศร้า
93,27/7/2021 16:05,fae39ec91fd9,เรากล้าที่จะกรีดตรงคอแล้วนะ,Level 5,#ซึมเศร้า #โรคซึมเศร้า #ครอบครัวไม่ใช่เซฟโซน
94,4/7/2021 14:36,2b8f37170b4e,บ่นเหนื่อยรอบที่ล้านทำไมไม่ตายๆไปสักทีวะตัวกู,Level 1,#โรคซึมเศร้า
95,24/6/2021 14:16,2f67905be441,เห้อเราต้องมีความรู้สึกแบบนี้ไม่ถึงเมื่อไหร่เครียดปัญหาเหนื่อยท้อแท้กับชีวิต,Other,#อยากตาย #โรคซึมเศร้า
96,15/5/2021 10:50,2b4fa5878b26,ชีวิตที่ไร้ความหมาย,Level 1,#โรคซึมเศร้า
98,17/9/2021 14:24,47d4853de6a1,การมีชีวิตอยู่ไม่น่าจดจำเท่ากับการจากไป,Level 1,#โรคซึมเศร้า #วันศุกร์กับซึมเศร้า
99,17/9/2021 14:24,47d4853de6a1,อยากหายไปจากทุกคนเลย,Level 1,#โรคซึมเศร้า #วันศุกร์กับซึมเศร้า
100,17/8/2021 16:18,7f96e8002228,ไม่ต้องสนใจรอยแผลพวกนี้หรอก,Level 5,#โรคซึมเศร้า
101,28/5/2021 07:47,372e9c133252,ไม่ใช่ว่าอยากจะตายแต่การมีชีวิตอยู่มันทรมาน,Other,#โรคซึมเศร้า
102,28/5/2021 13:43,4b6d444c656b,มันกลับมาอีกแล้วเครียดจนอยากจะเอามีดมาปาดคอตัวเองให้ตายอยู่แล้วใครก็ได้บอกเขาหยุดพูดทีหยุดตอกย้ำกันสักที,Level 4,#โรคซึมเศร้า
103,10/9/2021 16:41,4b6d444c656b,หมอเห็นแผลหนูไหม,Level 5,#โรคซึมเศร้า
104,29/6/2021 17:21,97e0beed816d,เค้าไล่ให้กูไปกระโดดตึกตาย,Other,#โรคซึมเศร้า
106,18/9/2021 19:33,97e0beed816d,เกือบจะเลิกทำร้ายตัวเองแล้วเชียว,Level 5,#โรคซึมเศร้า
108,4/9/2021 18:48,b3472ee14a1d,มีคนบอกให้เราตายด้วยดีใจจัง,Level 1,#โรคซึมเศร้า
109,10/8/2021 11:30,df7adbdf6353,ขอโทษนะที่มีชีวิตอยู่ต่อไม่ไหวแล้วบอบช้ำเหลือเกิน,Level 4,#โรคซึมเศร้า
110,10/8/2021 04:30,67acbd19d349,บรรจงกรีดใบมีดลงไปที่ข้อมือข้างซ้ายโดยไม่นึกถึงความเจ็บปวดใดๆนึกถึงแต่ความตายเท่านั้น,Level 5,#โรคซึมเศร้า
111,10/8/2021 04:27,67acbd19d349,อยากหลับแล้วไม่ตื่นขึ้นมาอีกเลยไม่ตื่นขึ้นมาแล้วได้มั้ยเหนื่อยเหลือเกินไม่อยากรู้สึกอะไรอีกแล้ว,Level 1,#โรคซึมเศร้า
112,6/9/2021 19:24,ffc585ae6706,เห็นแผลพวกนี้ไหมนั่นแปลว่าเราไม่ได้ดีขึ้นเลยแม้แต่น้อยนะ,Level 5,#โรคซึมเศร้า
